{
  "manifest_version": "1.0.0",
  "kind": "deck_pack",
  "deck_id": "org.latentdeck.deck.q4",
  "deck_version": "0.2.0",
  "display_name": "LatentDeck Q4",
  "summary": "Four-source carrier and donor latent synthesis.",
  "publisher": {
    "name": "LatentDeck",
    "url": null,
    "identity_claim": "self_declared"
  },
  "license": {
    "spdx_or_label": "Apache-2.0",
    "notice_path": "NOTICE.txt"
  },
  "compatibility": {
    "app_min_inclusive": "0.1.0",
    "app_max_exclusive": "1.0.0",
    "deck_host_api": 1,
    "worker_protocol": 2,
    "deck_operator_api": 1,
    "tensor_abi": "latentdeck.tensor.v1",
    "python": {
      "implementation": "cpython",
      "version": "3.13",
      "platform_tag": "win_amd64"
    },
    "torch_exact_build": "2.13.0+cu130"
  },
  "runtime": {
    "kind": "python_operator_stream_v1",
    "operator_descriptor_path": "operator.json",
    "python_root": "python",
    "entrypoint": "latentdeck_operator_q4.operator:process_sources_host"
  },
  "signal": {
    "slots": 4,
    "roles": [
      {"role_id": "carrier", "display_name": "Carrier"},
      {"role_id": "donor_b", "display_name": "Donor B"},
      {"role_id": "donor_c", "display_name": "Donor C"},
      {"role_id": "donor_d", "display_name": "Donor D"}
    ],
    "default_permutation": ["carrier", "donor_b", "donor_c", "donor_d"],
    "structural_carrier_role": "carrier",
    "geometry_allowlist": [
      {
        "dtype": "fp16",
        "device": "cuda",
        "batch": 1,
        "channels": 24,
        "temporal": 1,
        "height": 50,
        "width": 28
      },
      {
        "dtype": "fp16",
        "device": "cuda",
        "batch": 1,
        "channels": 24,
        "temporal": 1,
        "height": 48,
        "width": 28
      },
      {
        "dtype": "fp16",
        "device": "cuda",
        "batch": 1,
        "channels": 24,
        "temporal": 1,
        "height": 48,
        "width": 84
      },
      {
        "dtype": "fp16",
        "device": "cuda",
        "batch": 1,
        "channels": 24,
        "temporal": 1,
        "height": 30,
        "width": 45
      }
    ],
    "timing": {
      "frames_per_second_numerator": 24,
      "frames_per_second_denominator": 1,
      "samples_per_slot": 24
    },
    "required_capabilities": [
      "player",
      "realtime",
      "resample",
      "snapshot_capture",
      "live_capture"
    ],
    "profile_allowlist": null
  },
  "faceplate_path": "faceplate.json",
  "integrity": {
    "catalog_path": "integrity.json",
    "catalog_sha256": "53e165ea42f5afa96ba84a4ddc81cdb3faca8ca43a289b9bd7308316585017b6"
  }
}
